geoID,geoID2,geography,simpleGeography,meanSunriseTime,q1,q2,q3
310M100US38200,38200,"Pierre Part, LA Micro Area","Pierre Part, LA",6:38,-76,24,91
310M100US22780,22780,"Fort Leonard Wood, MO Micro Area","Fort Leonard Wood, MO",6:41,-80,26,99
310M100US25980,25980,"Hinesville-Fort Stewart, GA Metro Area","Hinesville, GA",6:59,-84,9,79
310M100US22860,22860,"Fort Polk South, LA Micro Area","Fort Polk South, LA",6:46,-66,22,88
310M100US15780,15780,"Camden, AR Micro Area","Camden, AR",6:44,-57,27,83
310M100US17500,17500,"Clewiston, FL Micro Area","Clewiston, FL",6:57,-39,16,65
310M100US27340,27340,"Jacksonville, NC Metro Area","Jacksonville, NC",6:42,-28,33,106
310M100US48100,48100,"Wauchula, FL Micro Area","Wauchula, FL",7:00,-33,23,73
310M100US23940,23940,"Gillette, WY Micro Area","Gillette, WY",6:33,-53,43,105
310M100US42460,42460,"Scottsboro, AL Micro Area","Scottsboro, AL",6:17,-24,67,139
310M100US10260,10260,"Adjuntas, PR Micro Area","Adjuntas, PR",6:22,11,63,101
310M100US10760,10760,"Alexander City, AL Micro Area","Alexander City, AL",6:16,2,66,131
310M100US17620,17620,"Coamo, PR Micro Area","Coamo, PR",6:20,-5,65,124
310M100US29980,29980,"Lawrenceburg, TN Micro Area","Lawrenceburg, TN",6:22,0,59,118
310M100US37700,37700,"Pascagoula, MS Metro Area","Pascagoula, MS",6:27,-77,58,132
310M100US19760,19760,"DeRidder, LA Micro Area","DeRidder, LA",6:46,-73,41,95
310M100US11580,11580,"Arcadia, FL Micro Area","Arcadia, FL",7:00,-35,24,84
310M100US23980,23980,"Glasgow, KY Micro Area","Glasgow, KY",6:16,9,65,136
310M100US42180,42180,"Santa Isabel, PR Micro Area","Santa Isabel, PR",6:20,8,67,124
310M100US17300,17300,"Clarksville, TN-KY Metro Area","Clarksville, TN",6:22,-9,63,139
310M100US14220,14220,"Bogalusa, LA Micro Area","Bogalusa, LA",6:32,-20,55,123
310M100US32660,32660,"McMinnville, TN Micro Area","McMinnville, TN",6:15,6,69,140
310M100US43180,43180,"Shelbyville, TN Micro Area","Shelbyville, TN",6:18,-1,68,133
310M100US26020,26020,"Hobbs, NM Micro Area","Hobbs, NM",6:25,-17,54,115
310M100US22840,22840,"Fort Payne, AL Micro Area","Fort Payne, AL",6:15,-1,71,137
310M100US47780,47780,"Washington, IN Micro Area","Washington, IN",7:21,-66,2,65
310M100US13180,13180,"Beaver Dam, WI Micro Area","Beaver Dam, WI",6:27,-56,58,139
310M100US38100,38100,"Picayune, MS Micro Area","Picayune, MS",6:32,-53,60,116
310M100US29860,29860,"Laurel, MS Micro Area","Laurel, MS",6:29,-8,56,109
310M100US36660,36660,"Opelousas-Eunice, LA Micro Area","Opelousas, LA",6:41,-20,47,95
310M100US21220,21220,"Elko, NV Micro Area","Elko, NV",6:15,-103,67,168
310M100US26180,26180,"Honolulu, HI Metro Area","Honolulu, HI",6:26,-5,65,147
310M100US32980,32980,"Merrill, WI Micro Area","Merrill, WI",6:30,-15,56,128
310M100US30500,30500,"Lexington Park, MD Micro Area","Lexington Park, MD",6:38,-10,52,112
310M100US26380,26380,"Houma-Bayou Cane-Thibodaux, LA Metro Area","Houma, LA",6:36,-19,50,106
310M100US37260,37260,"Palatka, FL Micro Area","Palatka, FL",6:59,-35,32,95
310M100US48060,48060,"Watertown-Fort Drum, NY Micro Area","Watertown, NY",6:34,-9,51,119
310M100US27580,27580,"Jayuya, PR Micro Area","Jayuya, PR",6:21,2,63,126
310M100US40940,40940,"Safford, AZ Micro Area","Safford, AZ",6:12,-62,70,143
310M100US14300,14300,"Bonham, TX Micro Area","Bonham, TX",6:57,-40,35,93
310M100US27540,27540,"Jasper, IN Micro Area","Jasper, IN",7:20,-62,6,68
310M100US36380,36380,"Okeechobee, FL Micro Area","Okeechobee, FL",6:56,-31,30,95
310M100US28660,28660,"Killeen-Temple-Fort Hood, TX Metro Area","Killeen, TX",7:04,-47,23,88
310M100US41220,41220,"St. Marys, GA Micro Area","St. Marys, GA",6:59,-24,29,95
310M100US45180,45180,"Talladega-Sylacauga, AL Micro Area","Talladega, AL",6:17,-5,73,150
310M100US10700,10700,"Albertville, AL Micro Area","Albertville, AL",6:17,8,71,142
310M100US10020,10020,"Abbeville, LA Micro Area","Abbeville, LA",6:41,-19,51,104
310M100US28340,28340,"Kendallville, IN Micro Area","Kendallville, IN",7:13,-104,17,119
310M100US14740,14740,"Bremerton-Silverdale, WA Metro Area","Bremerton, WA",6:41,-19,51,135
310M100US35860,35860,"North Vernon, IN Micro Area","North Vernon, IN",7:14,-50,20,121
310M100US33380,33380,"Minden, LA Micro Area","Minden, LA",6:46,-23,43,111
310M100US49500,49500,"Yauco, PR Metro Area","Yauco, PR",6:22,9,70,115
310M100US21640,21640,"Eufaula, AL-GA Micro Area","Eufaula, AL",6:13,15,76,198
310M100US18980,18980,"Cullman, AL Micro Area","Cullman, AL",6:20,-5,72,136
310M100US20380,20380,"Dunn, NC Micro Area","Dunn, NC",6:47,-14,50,115
310M100US27660,27660,"Jennings, LA Micro Area","Jennings, LA",6:43,-24,48,107
310M100US30280,30280,"Lewisburg, TN Micro Area","Lewisburg, TN",6:20,7,74,150
310M100US43220,43220,"Shelton, WA Micro Area","Shelton, WA",6:43,-28,56,132
310M100US25020,25020,"Guayama, PR Metro Area","Guayama, PR",6:19,12,71,124
310M100US34300,34300,"Mountain Home, ID Micro Area","Mountain Home, ID",7:14,-47,11,80
310M100US41980,41980,"San Juan-Caguas-Guaynabo, PR Metro Area","San Juan, PR",6:19,15,83,149
310M100US25260,25260,"Hanford-Corcoran, CA Metro Area","Hanford, CA",6:31,-15,58,136
310M100US11500,11500,"Anniston-Oxford, AL Metro Area","Anniston, AL",6:16,-1,76,164
310M100US46580,46580,"Utuado, PR Micro Area","Utuado, PR",6:21,12,74,116
310M100US18940,18940,"Crowley, LA Micro Area","Crowley, LA",6:42,-23,50,107
310M100US30060,30060,"Lebanon, MO Micro Area","Lebanon, MO",6:43,-59,47,113
310M100US21140,21140,"Elkhart-Goshen, IN Metro Area","Elkhart, IN",7:15,-119,15,85
310M100US41900,41900,"San Germán-Cabo Rojo, PR Metro Area","San Germ, PR",6:23,16,72,124
310M100US15020,15020,"Brookhaven, MS Micro Area","Brookhaven, MS",6:34,-12,56,128
310M100US18900,18900,"Crossville, TN Micro Area","Crossville, TN",6:12,33,79,144
310M100US46180,46180,"Tupelo, MS Micro Area","Tupelo, MS",6:27,8,64,115
310M100US24700,24700,"Greensburg, IN Micro Area","Greensburg, IN",7:14,-55,15,142
310M100US39260,39260,"Prineville, OR Micro Area","Prineville, OR",6:34,-26,54,119
310M100US13620,13620,"Berlin, NH-VT Micro Area","Berlin, NH",6:16,13,74,138
310M100US16420,16420,"Central City, KY Micro Area","Central City, KY",6:21,3,69,140
310M100US25220,25220,"Hammond, LA Micro Area","Hammond, LA",6:35,-19,60,128
310M100US44780,44780,"Sturgis, MI Micro Area","Sturgis, MI",7:13,-48,21,94
310M100US23900,23900,"Gettysburg, PA Micro Area","Gettysburg, PA",6:41,-16,55,144
310M100US38660,38660,"Ponce, PR Metro Area","Ponce, PR",6:21,10,73,136
310M100US12540,12540,"Bakersfield-Delano, CA Metro Area","Bakersfield, CA",6:28,-14,64,138
310M100US19460,19460,"Decatur, AL Metro Area","Decatur, AL",6:20,6,76,144
310M100US43660,43660,"Snyder, TX Micro Area","Snyder, TX",7:16,-51,9,69
310M100US48020,48020,"Watertown-Fort Atkinson, WI Micro Area","Watertown, WI",6:26,-5,66,147
310M100US27700,27700,"Jesup, GA Micro Area","Jesup, GA",7:00,-21,31,80
310M100US21460,21460,"Enterprise-Ozark, AL Micro Area","Enterprise, AL",6:16,8,76,144
310M100US34180,34180,"Moses Lake, WA Micro Area","Moses Lake, WA",6:28,-6,61,121
310M100US24980,24980,"Grenada, MS Micro Area","Grenada, MS",6:32,-2,57,122
310M100US13060,13060,"Bay City, TX Micro Area","Bay City, TX",6:57,-37,35,94
310M100US31460,31460,"Madera-Chowchilla, CA Metro Area","Madera, CA",6:32,-12,63,122
310M100US19020,19020,"Culpeper, VA Micro Area","Culpeper, VA",6:44,-20,57,119
310M100US23460,23460,"Gadsden, AL Metro Area","Gadsden, AL",6:17,9,76,163
310M100US33820,33820,"Monroe, WI Micro Area","Monroe, WI",6:30,-5,63,128
310M100US25060,25060,"Gulfport-Biloxi, MS Metro Area","Gulfport, MS",6:29,-1,66,147
310M100US31820,31820,"Manitowoc, WI Micro Area","Manitowoc, WI",6:22,-10,68,187
310M100US37300,37300,"Palestine, TX Micro Area","Palestine, TX",6:55,-28,37,92
310M100US42780,42780,"Selinsgrove, PA Micro Area","Selinsgrove, PA",6:39,-14,57,128
310M100US22620,22620,"Forrest City, AR Micro Area","Forrest City, AR",6:36,-8,55,120
310M100US25900,25900,"Hilo, HI Micro Area","Hilo, HI",6:15,18,79,149
310M100US15140,15140,"Brownsville, TN Micro Area","Brownsville, TN",6:29,1,64,127
310M100US46500,46500,"Urbana, OH Micro Area","Urbana, OH",7:07,-40,30,105
310M100US49540,49540,"Yazoo City, MS Micro Area","Yazoo City, MS",6:34,9,63,126
310M100US18260,18260,"Cookeville, TN Micro Area","Cookeville, TN",6:14,31,83,133
310M100US34020,34020,"Morgan City, LA Micro Area","Morgan City, LA",6:38,-14,53,108
310M100US28420,28420,"Kennewick-Pasco-Richland, WA Metro Area","Kennewick, WA",6:28,-3,66,140
310M100US21940,21940,"Fajardo, PR Metro Area","Fajardo, PR",6:17,9,80,155
310M100US42820,42820,"Selma, AL Micro Area","Selma, AL",6:21,2,72,141
310M100US49740,49740,"Yuma, AZ Metro Area","Yuma, AZ",6:32,-15,60,138
310M100US34460,34460,"Mount Sterling, KY Micro Area","Mount Sterling, KY",7:08,-42,26,95
310M100US22140,22140,"Farmington, NM Metro Area","Farmington, NM",6:45,-18,50,112
310M100US20900,20900,"El Campo, TX Micro Area","El Campo, TX",6:58,-26,35,79
310M100US22280,22280,"Fernley, NV Micro Area","Fernley, NV",6:29,-2,73,147
310M100US41820,41820,"Sanford, NC Micro Area","Sanford, NC",6:49,-13,46,106
310M100US35340,35340,"New Iberia, LA Micro Area","New Iberia, LA",6:40,-7,54,109
310M100US26480,26480,"Humboldt, TN Micro Area","Humboldt, TN",6:28,14,70,120
310M100US33660,33660,"Mobile, AL Metro Area","Mobile, AL",6:25,10,73,139
310M100US12820,12820,"Bastrop, LA Micro Area","Bastrop, LA",6:40,-5,55,115
310M100US42620,42620,"Searcy, AR Micro Area","Searcy, AR",6:39,-11,55,112
310M100US12940,12940,"Baton Rouge, LA Metro Area","Baton Rouge, LA",6:37,-4,62,126
310M100US20180,20180,"DuBois, PA Micro Area","DuBois, PA",6:47,-20,47,131
310M100US47500,47500,"Walterboro, SC Micro Area","Walterboro, SC",6:55,-32,50,107
310M100US13140,13140,"Beaumont-Port Arthur, TX Metro Area","Beaumont, TX",6:49,-23,46,110
310M100US30740,30740,"Lincolnton, NC Micro Area","Lincolnton, NC",6:57,-17,48,118
310M100US14180,14180,"Blytheville, AR Micro Area","Blytheville, AR",6:32,-7,61,149
310M100US29340,29340,"Lake Charles, LA Metro Area","Lake Charles, LA",6:46,-17,49,116
310M100US36980,36980,"Owensboro, KY Metro Area","Owensboro, KY",6:20,21,74,152
310M100US49700,49700,"Yuba City, CA Metro Area","Yuba City, CA",6:38,-16,61,148
310M100US11380,11380,"Andrews, TX Micro Area","Andrews, TX",7:23,-50,7,73
310M100US25760,25760,"Helena-West Helena, AR Micro Area","Helena, AR",6:35,2,56,116
310M100US42380,42380,"Sayre, PA Micro Area","Sayre, PA",6:38,-15,58,128
310M100US22180,22180,"Fayetteville, NC Metro Area","Fayetteville, NC",6:48,-24,50,119
310M100US20020,20020,"Dothan, AL Metro Area","Dothan, AL",6:14,26,82,146
310M100US45380,45380,"Taylorville, IL Micro Area","Taylorville, IL",6:29,4,69,127
310M100US24180,24180,"Granbury, TX Micro Area","Granbury, TX",7:04,-33,37,100
310M100US16900,16900,"Chester, SC Micro Area","Chester, SC",6:57,-12,48,115
310M100US19540,19540,"Decatur, IN Micro Area","Decatur, IN",7:11,-50,23,88
310M100US32620,32620,"McComb, MS Micro Area","McComb, MS",6:35,4,61,147
310M100US48500,48500,"West Point, MS Micro Area","West Point, MS",6:27,-7,70,160
310M100US37740,37740,"Payson, AZ Micro Area","Payson, AZ",6:19,-8,73,134
310M100US30820,30820,"Lock Haven, PA Micro Area","Lock Haven, PA",6:41,-15,55,150
310M100US12300,12300,"Augusta-Waterville, ME Micro Area","Augusta, ME",6:10,26,89,150
310M100US38700,38700,"Pontiac, IL Micro Area","Pontiac, IL",6:26,2,66,135
310M100US34700,34700,"Muscatine, IA Micro Area","Muscatine, IA",6:36,-16,58,154
310M100US22820,22820,"Fort Morgan, CO Micro Area","Fort Morgan, CO",6:27,-3,63,129
310M100US27380,27380,"Jacksonville, TX Micro Area","Jacksonville, TX",6:54,0,42,95
310M100US15900,15900,"Canton, IL Micro Area","Canton, IL",6:32,-11,69,137
310M100US47080,47080,"Vidalia, GA Micro Area","Vidalia, GA",7:02,-27,34,82
310M100US40300,40300,"Rochelle, IL Micro Area","Rochelle, IL",6:28,-6,72,154
310M100US32460,32460,"Mayfield, KY Micro Area","Mayfield, KY",6:27,19,71,147
310M100US10380,10380,"Aguadilla-Isabela-San Sebastián, PR Metro Area","Aguadilla, PR",6:23,20,77,136
310M100US22540,22540,"Fond du Lac, WI Metro Area","Fond du Lac, WI",6:25,1,71,175
310M100US42900,42900,"Seneca Falls, NY Micro Area","Seneca Falls, NY",6:39,-7,59,126
310M100US46460,46460,"Union City, TN-KY Micro Area","Union City, TN",6:28,18,68,138
310M100US45980,45980,"Troy, AL Micro Area","Troy, AL",6:17,9,76,155
310M100US40140,40140,"Riverside-San Bernardino-Ontario, CA Metro Area","Riverside, CA",6:22,0,81,179
310M100US47300,47300,"Visalia-Porterville, CA Metro Area","Visalia, CA",6:29,-13,68,141
310M100US42980,42980,"Seymour, IN Micro Area","Seymour, IN",7:15,-52,22,119
310M100US46980,46980,"Vicksburg, MS Micro Area","Vicksburg, MS",6:36,7,59,117
310M100US19940,19940,"Dixon, IL Micro Area","Dixon, IL",6:29,-1,67,146
310M100US18880,18880,"Crestview-Fort Walton Beach-Destin, FL Metro Area","Crestview, FL",6:19,15,81,165
310M100US46100,46100,"Tullahoma, TN Micro Area","Tullahoma, TN",6:17,18,82,165
310M100US39860,39860,"Red Wing, MN Micro Area","Red Wing, MN",6:41,-16,59,134
310M100US43460,43460,"Sikeston, MO Micro Area","Sikeston, MO",6:30,4,66,136
310M100US25780,25780,"Henderson, NC Micro Area","Henderson, NC",6:46,-8,52,118
310M100US17940,17940,"Columbia, TN Micro Area","Columbia, TN",6:21,13,82,163
310M100US10780,10780,"Alexandria, LA Metro Area","Alexandria, LA",6:43,-7,55,118
310M100US46420,46420,"Union, SC Micro Area","Union, SC",6:59,-24,42,107
310M100US31940,31940,"Marinette, WI-MI Micro Area","Marinette, WI",6:21,-10,74,192
310M100US32220,32220,"Marshall, TX Micro Area","Marshall, TX",6:50,-16,49,122
310M100US25180,25180,"Hagerstown-Martinsburg, MD-WV Metro Area","Hagerstown, MD",6:44,-18,59,152
310M100US37800,37800,"Pella, IA Micro Area","Pella, IA",6:43,-11,51,115
310M100US49420,49420,"Yakima, WA Metro Area","Yakima, WA",6:33,-1,65,132
310M100US21060,21060,"Elizabethtown, KY Metro Area","Elizabethtown, KY",7:16,-40,23,90
310M100US15860,15860,"Cañon City, CO Micro Area","Ca, CO",6:33,-1,63,144
310M100US13820,13820,"Birmingham-Hoover, AL Metro Area","Birmingham, AL",6:20,23,84,149
310M100US33860,33860,"Montgomery, AL Metro Area","Montgomery, AL",6:18,30,83,147
310M100US38500,38500,"Plymouth, IN Micro Area","Plymouth, IN",7:17,-56,21,97
310M100US24540,24540,"Greeley, CO Metro Area","Greeley, CO",6:31,4,71,146
310M100US16540,16540,"Chambersburg, PA Micro Area","Chambersburg, PA",6:42,-14,59,139
310M100US47700,47700,"Warsaw, IN Micro Area","Warsaw, IN",7:15,-55,23,108
310M100US16100,16100,"Carlsbad-Artesia, NM Micro Area","Carlsbad, NM",6:30,-3,64,116
310M100US20140,20140,"Dublin, GA Micro Area","Dublin, GA",7:04,-14,34,91
310M100US19300,19300,"Daphne-Fairhope-Foley, AL Micro Area","Daphne, AL",6:24,18,78,141
310M100US49620,49620,"York-Hanover, PA Metro Area","York, PA",6:39,-4,63,148
310M100US35100,35100,"New Bern, NC Micro Area","New Bern, NC",6:41,-7,57,127
310M100US36940,36940,"Owatonna, MN Micro Area","Owatonna, MN",6:44,-5,49,111
310M100US27620,27620,"Jefferson City, MO Metro Area","Jefferson City, MO",6:41,7,57,104
310M100US43380,43380,"Sidney, OH Micro Area","Sidney, OH",7:08,-42,30,143
310M100US24580,24580,"Green Bay, WI Metro Area","Green Bay, WI",6:23,10,76,158
310M100US11980,11980,"Athens, TX Micro Area","Athens, TX",6:56,-25,48,111
310M100US18620,18620,"Corsicana, TX Micro Area","Corsicana, TX",6:59,-25,40,115
310M100US33620,33620,"Moberly, MO Micro Area","Moberly, MO",6:42,1,55,113
310M100US40540,40540,"Rock Springs, WY Micro Area","Rock Springs, WY",6:49,-23,46,122
310M100US30380,30380,"Lewistown, PA Micro Area","Lewistown, PA",6:42,-13,57,170
310M100US32940,32940,"Meridian, MS Micro Area","Meridian, MS",6:27,17,73,139
310M100US26420,26420,"Houston-Sugar Land-Baytown, TX Metro Area","Houston, TX",6:54,-13,53,121
310M100US38580,38580,"Point Pleasant, WV-OH Micro Area","Point Pleasant, WV",7:00,-17,43,106
310M100US10620,10620,"Albemarle, NC Micro Area","Albemarle, NC",6:53,-19,49,110
310M100US22100,22100,"Farmington, MO Micro Area","Farmington, MO",6:34,-8,65,153
310M100US32420,32420,"Mayagüez, PR Metro Area","Mayag, PR",6:23,38,79,145
310M100US21980,21980,"Fallon, NV Micro Area","Fallon, NV",6:27,8,68,118
310M100US11860,11860,"Atchison, KS Micro Area","Atchison, KS",6:52,-20,42,122
310M100US24820,24820,"Greenville, OH Micro Area","Greenville, OH",7:10,-41,30,116
310M100US15660,15660,"Calhoun, GA Micro Area","Calhoun, GA",7:12,-7,31,92
310M100US18740,18740,"Coshocton, OH Micro Area","Coshocton, OH",6:59,-41,40,131
310M100US37860,37860,"Pensacola-Ferry Pass-Brent, FL Metro Area","Pensacola, FL",6:22,21,80,149
310M100US18060,18060,"Columbus, MS Micro Area","Columbus, MS",6:26,19,73,152
310M100US14940,14940,"Brigham City, UT Micro Area","Brigham City, UT",7:00,-44,40,140
310M100US12380,12380,"Austin, MN Micro Area","Austin, MN",6:43,-22,51,206
310M100US43420,43420,"Sierra Vista-Douglas, AZ Micro Area","Sierra Vista, AZ",6:15,18,83,149
310M100US26940,26940,"Indianola, MS Micro Area","Indianola, MS",6:35,8,60,112
310M100US37500,37500,"Paragould, AR Micro Area","Paragould, AR",6:34,9,64,180
310M100US44900,44900,"Summerville, GA Micro Area","Summerville, GA",7:14,-1,26,83
310M100US43740,43740,"Somerset, PA Micro Area","Somerset, PA",6:48,-19,52,124
310M100US28820,28820,"Kinston, NC Micro Area","Kinston, NC",6:43,-3,58,127
310M100US24900,24900,"Greenwood, MS Micro Area","Greenwood, MS",6:33,19,63,97
310M100US45620,45620,"Thomasville, GA Micro Area","Thomasville, GA",7:09,-19,30,84
310M100US21020,21020,"Elizabeth City, NC Micro Area","Elizabeth City, NC",6:37,-1,64,126
310M100US39700,39700,"Raymondville, TX Micro Area","Raymondville, TX",7:04,-7,35,80
310M100US38060,38060,"Phoenix-Mesa-Glendale, AZ Metro Area","Phoenix, AZ",6:21,11,85,169
310M100US32280,32280,"Martin, TN Micro Area","Martin, TN",6:28,9,72,134
310M100US33140,33140,"Michigan City-La Porte, IN Metro Area","Michigan City, IN",6:19,5,82,177
310M100US27980,27980,"Kahului-Wailuku, HI Micro Area","Kahului, HI",6:20,21,80,178
310M100US32270,32270,"Marshfield-Wisconsin Rapids, WI Micro Area","Marshfield, WI",6:32,6,64,145
310M100US49020,49020,"Winchester, VA-WV Metro Area","Winchester, VA",6:45,-15,59,132
310M100US17200,17200,"Claremont, NH Micro Area","Claremont, NH",6:21,17,84,147
310M100US16340,16340,"Cedartown, GA Micro Area","Cedartown, GA",7:13,-43,31,121
310M100US35900,35900,"North Wilkesboro, NC Micro Area","North Wilkesboro, NC",6:57,-10,46,109
310M100US37820,37820,"Pendleton-Hermiston, OR Micro Area","Pendleton, OR",6:26,1,70,164
310M100US39540,39540,"Racine, WI Metro Area","Racine, WI",6:23,16,80,163
310M100US30020,30020,"Lawton, OK Metro Area","Lawton, OK",7:06,-39,32,105
310M100US34220,34220,"Moultrie, GA Micro Area","Moultrie, GA",7:08,-19,32,93
310M100US48180,48180,"Waycross, GA Micro Area","Waycross, GA",7:02,-20,38,98
310M100US48140,48140,"Wausau, WI Metro Area","Wausau, WI",6:30,6,69,146
310M100US32900,32900,"Merced, CA Metro Area","Merced, CA",6:34,-16,66,150
310M100US11540,11540,"Appleton, WI Metro Area","Appleton, WI",6:25,11,75,144
310M100US39060,39060,"Pottsville, PA Micro Area","Pottsville, PA",6:36,-9,67,161
310M100US20540,20540,"Dyersburg, TN Micro Area","Dyersburg, TN",6:30,13,68,131
310M100US29180,29180,"Lafayette, LA Metro Area","Lafayette, LA",6:41,8,61,122
310M100US47660,47660,"Warrensburg, MO Micro Area","Warrensburg, MO",6:47,-9,53,181
310M100US37220,37220,"Pahrump, NV Micro Area","Pahrump, NV",6:16,-51,84,208
310M100US10460,10460,"Alamogordo, NM Micro Area","Alamogordo, NM",6:36,5,65,123
310M100US48580,48580,"Whitewater, WI Micro Area","Whitewater, WI",6:26,11,76,175
310M100US30340,30340,"Lewiston-Auburn, ME Metro Area","Lewiston, ME",6:12,25,90,162
310M100US26620,26620,"Huntsville, AL Metro Area","Huntsville, AL",6:19,30,85,145
310M100US44580,44580,"Sterling, IL Micro Area","Sterling, IL",6:30,-7,70,132
310M100US47540,47540,"Wapakoneta, OH Micro Area","Wapakoneta, OH",7:08,-39,33,140
310M100US35060,35060,"Natchitoches, LA Micro Area","Natchitoches, LA",6:45,-10,55,130
310M100US29220,29220,"La Follette, TN Micro Area","La Follette, TN",7:09,-34,36,124
310M100US43260,43260,"Sheridan, WY Micro Area","Sheridan, WY",6:39,3,57,111
310M100US46700,46700,"Vallejo-Fairfield, CA Metro Area","Vallejo, CA",6:41,-8,65,157
310M100US27140,27140,"Jackson, MS Metro Area","Jackson, MS",6:33,23,72,127
310M100US23140,23140,"Frankfort, IN Micro Area","Frankfort, IN",7:18,-52,24,187
310M100US44700,44700,"Stockton, CA Metro Area","Stockton, CA",6:37,-15,68,161
310M100US17220,17220,"Clarksburg, WV Micro Area","Clarksburg, WV",6:53,-10,51,124
310M100US30980,30980,"Longview, TX Metro Area","Longview, TX",6:52,-15,50,111
310M100US37540,37540,"Paris, TN Micro Area","Paris, TN",6:25,24,76,126
310M100US25300,25300,"Hannibal, MO Micro Area","Hannibal, MO",6:37,-1,62,125
310M100US33020,33020,"Mexico, MO Micro Area","Mexico, MO",6:39,4,58,133
310M100US15700,15700,"Cambridge, MD Micro Area","Cambridge, MD",6:36,5,68,127
310M100US26500,26500,"Huntingdon, PA Micro Area","Huntingdon, PA",6:44,-17,62,161
310M100US16940,16940,"Cheyenne, WY Metro Area","Cheyenne, WY",6:31,16,67,121
310M100US34980,34980,"Nashville-Davidson--Murfreesboro--Franklin, TN Metro Area","Nashville, TN",6:19,29,89,164
310M100US10540,10540,"Albany-Lebanon, OR Micro Area","Albany, OR",6:43,-11,62,139
310M100US20980,20980,"El Dorado, AR Micro Area","El Dorado, AR",6:43,-2,57,112
310M100US22520,22520,"Florence-Muscle Shoals, AL Metro Area","Florence, AL",6:23,12,80,151
310M100US35940,35940,"Norwalk, OH Micro Area","Norwalk, OH",7:02,-33,40,164
310M100US33420,33420,"Mineral Wells, TX Micro Area","Mineral Wells, TX",7:05,-32,36,92
310M100US47020,47020,"Victoria, TX Metro Area","Victoria, TX",7:01,-23,40,98
310M100US21780,21780,"Evansville, IN-KY Metro Area","Evansville, IN",6:22,17,81,180
310M100US10880,10880,"Allegan, MI Micro Area","Allegan, MI",7:15,-36,31,112
310M100US18420,18420,"Corinth, MS Micro Area","Corinth, MS",6:26,19,75,140
310M100US21580,21580,"Espanola, NM Micro Area","Espanola, NM",6:37,12,71,121
310M100US12140,12140,"Auburn, IN Micro Area","Auburn, IN",7:12,-46,30,126
310M100US35500,35500,"Newton, IA Micro Area","Newton, IA",6:44,-8,59,123
310M100US31920,31920,"Marble Falls, TX Micro Area","Marble Falls, TX",7:06,-20,39,107
310M100US35420,35420,"New Philadelphia-Dover, OH Micro Area","New Philadelphia, OH",6:57,-29,45,130
310M100US36860,36860,"Ottawa-Streator, IL Micro Area","Ottawa, IL",6:27,-2,74,159
310M100US24140,24140,"Goldsboro, NC Metro Area","Goldsboro, NC",6:44,2,59,142
310M100US20060,20060,"Douglas, GA Micro Area","Douglas, GA",7:04,-22,37,94
310M100US46220,46220,"Tuscaloosa, AL Metro Area","Tuscaloosa, AL",6:23,20,82,158
310M100US35220,35220,"New Castle, IN Micro Area","New Castle, IN",7:13,-45,33,123
310M100US25340,25340,"Harriman, TN Micro Area","Harriman, TN",7:11,-36,36,112
310M100US40340,40340,"Rochester, MN Metro Area","Rochester, MN",6:41,9,60,123
310M100US29540,29540,"Lancaster, PA Metro Area","Lancaster, PA",6:37,1,66,145
310M100US34420,34420,"Mount Pleasant, TX Micro Area","Mount Pleasant, TX",6:52,-12,47,125
310M100US35580,35580,"New Ulm, MN Micro Area","New Ulm, MN",6:49,-12,48,115
310M100US25820,25820,"Hereford, TX Micro Area","Hereford, TX",7:22,-49,15,59
310M100US22220,22220,"Fayetteville-Springdale-Rogers, AR-MO Metro Area","Fayetteville, AR",6:49,3,55,117
310M100US26780,26780,"Hutchinson, MN Micro Area","Hutchinson, MN",6:49,-17,52,129
310M100US37460,37460,"Panama City-Lynn Haven-Panama City Beach, FL Metro Area","Panama City, FL",6:16,29,88,172
310M100US44980,44980,"Sunbury, PA Micro Area","Sunbury, PA",6:39,-4,67,168
310M100US20340,20340,"Duncan, OK Micro Area","Duncan, OK",7:04,-25,37,92
310M100US40500,40500,"Rockland, ME Micro Area","Rockland, ME",6:08,32,93,152
310M100US26260,26260,"Hope, AR Micro Area","Hope, AR",6:47,-6,57,117
310M100US23620,23620,"Gainesville, TX Micro Area","Gainesville, TX",7:01,-30,42,114
310M100US22340,22340,"Fitzgerald, GA Micro Area","Fitzgerald, GA",7:06,-18,36,89
310M100US39780,39780,"Red Bluff, CA Micro Area","Red Bluff, CA",6:41,-11,65,144
310M100US30140,30140,"Lebanon, PA Metro Area","Lebanon, PA",6:37,2,69,158
310M100US13340,13340,"Bellefontaine, OH Micro Area","Bellefontaine, OH",7:07,-42,37,160
310M100US25620,25620,"Hattiesburg, MS Metro Area","Hattiesburg, MS",6:30,16,74,145
310M100US36060,36060,"Oak Hill, WV Micro Area","Oak Hill, WV",6:57,-12,50,148
310M100US24620,24620,"Greeneville, TN Micro Area","Greeneville, TN",7:03,-26,43,125
310M100US22980,22980,"Fort Valley, GA Micro Area","Fort Valley, GA",7:08,-26,40,139
310M100US48300,48300,"Wenatchee-East Wenatchee, WA Metro Area","Wenatchee, WA",6:32,11,70,132
310M100US34540,34540,"Mount Vernon, OH Micro Area","Mount Vernon, OH",7:02,-24,44,126
310M100US30780,30780,"Little Rock-North Little Rock-Conway, AR Metro Area","Little Rock, AR",6:42,10,64,124
310M100US11220,11220,"Amsterdam, NY Micro Area","Amsterdam, NY",6:28,5,78,154
310M100US41700,41700,"San Antonio-New Braunfels, TX Metro Area","San Antonio, TX",7:07,-17,41,119
310M100US37940,37940,"Peru, IN Micro Area","Peru, IN",7:16,-37,30,178
310M100US37140,37140,"Paducah, KY-IL Micro Area","Paducah, KY",6:27,13,75,149
310M100US13260,13260,"Bedford, IN Micro Area","Bedford, IN",7:18,-52,28,101
310M100US46260,46260,"Tuskegee, AL Micro Area","Tuskegee, AL",6:15,34,92,214
310M100US46900,46900,"Vernon, TX Micro Area","Vernon, TX",7:10,-28,27,58
310M100US20940,20940,"El Centro, CA Metro Area","El Centro, CA",6:15,-4,89,161
310M100US24100,24100,"Gloversville, NY Micro Area","Gloversville, NY",6:29,12,75,172
310M100US36020,36020,"Oak Harbor, WA Micro Area","Oak Harbor, WA",6:41,-6,63,163
310M100US23580,23580,"Gainesville, GA Metro Area","Gainesville, GA",7:08,-11,40,119
310M100US17820,17820,"Colorado Springs, CO Metro Area","Colorado Springs, CO",6:31,15,76,145
310M100US18500,18500,"Corning, NY Micro Area","Corning, NY",6:40,3,64,125
310M100US41260,41260,"St. Marys, PA Micro Area","St. Marys, PA",6:46,-3,56,201
310M100US18460,18460,"Cornelia, GA Micro Area","Cornelia, GA",7:07,-16,37,98
